{
  "examType": "neetpg",
  "examTitle": "NEET-PG CBT Mock Test",
  "totalBlocks": 5,
  "defaultBlockDurationMinutes": 5,
  "markingScheme": {
    "correct": 4,
    "incorrect": -1,
    "unattempted": 0
  },
  "sections": [
    {
      "id": "sec_a",
      "name": "Section A",
      "durationMinutes": 5,
      "questions": [
        {
          "id": "neet_q_1",
          "subject": [
            "Anatomy",
            "Orthopedics"
          ],
          "system": [
            "Upper Limb",
            "Central Nervous System",
            "Musculoskeletal System"
          ],
          "format": "Single Best Answer",
          "difficulty": "Medium",
          "topic": "Radial Nerve Injury & Spiral Groove Anatomy",
          "reference": "Gray's Anatomy for Students, 4th ed., Ch. 7; Bailey & Love's Short Practice of Surgery, 28th ed.",
          "text": "A 28-year-old motorcyclist sustains a mid-shaft fracture of the humerus. On clinical examination, he is unable to extend his wrist and digits at the metacarpophalangeal joints, with loss of sensation over the first dorsal web space. Which nerve and corresponding artery are most vulnerable to injury at this anatomical location?",
          "options": [
            "Radial nerve and profunda brachii artery",
            "Median nerve and brachial artery",
            "Ulnar nerve and superior ulnar collateral artery",
            "Axillary nerve and posterior circumflex humeral artery"
          ],
          "correctAnswerIndex": 0,
          "explanation": "The radial nerve and profunda brachii artery course together along the spiral (radial) groove on the posterior surface of the mid-shaft of the humerus. Injury causes radial nerve palsy presenting as wrist drop and first dorsal web space sensory loss.",
          "style": "Clinical Vignette"
        },
        {
          "id": "neet_q_2",
          "subject": [
            "Physiology"
          ],
          "system": [
            "Cardiovascular System"
          ],
          "format": "Single Best Answer",
          "difficulty": "Easy",
          "topic": "Cardiac Cycle Mechanics",
          "reference": "Guyton and Hall Textbook of Medical Physiology, 14th ed., Ch. 9",
          "text": "In a normal cardiac cycle, which phase immediately follows the closure of the atrioventricular (mitral and tricuspid) valves and precedes the opening of the aortic and pulmonary semilunar valves?",
          "options": [
            "Isovolumetric contraction phase",
            "Rapid ventricular ejection phase",
            "Isovolumetric relaxation phase",
            "Reduced ventricular filling phase"
          ],
          "correctAnswerIndex": 0,
          "explanation": "Isovolumetric contraction begins with AV valve closure (producing the S1 heart sound). During this brief phase, all four valves are closed and intraventricular pressure rises steeply until it exceeds aortic/pulmonary diastolic pressure.",
          "style": "One-Liner"
        },
        {
          "id": "neet_q_3",
          "subject": [
            "Anatomy",
            "Surgery",
            "ENT"
          ],
          "system": [
            "Head & Neck",
            "Endocrine System"
          ],
          "format": "Single Best Answer",
          "difficulty": "Medium",
          "topic": "Laryngeal Nerve Anatomy & Thyroid Surgery",
          "reference": "Bailey & Love's Short Practice of Surgery, 28th ed., Ch. 52",
          "text": "During an elective subtotal thyroidectomy, the surgeon must carefully identify and preserve the external branch of the superior laryngeal nerve. Which muscle is exclusively innervated by this nerve?",
          "options": [
            "Cricothyroid muscle",
            "Posterior cricoarytenoid muscle",
            "Lateral cricoarytenoid muscle",
            "Thyroarytenoid muscle"
          ],
          "correctAnswerIndex": 0,
          "explanation": "The external branch of the superior laryngeal nerve innervates only the cricothyroid muscle (the chief tensor of the vocal folds). All other intrinsic laryngeal muscles are innervated by the recurrent laryngeal nerve.",
          "style": "Clinical Vignette"
        },
        {
          "id": "neet_q_4",
          "subject": [
            "Physiology"
          ],
          "system": [
            "Renal & Urinary System",
            "Cardiovascular System"
          ],
          "format": "Single Best Answer",
          "difficulty": "Medium",
          "topic": "Tubuloglomerular Feedback & Juxtaglomerular Apparatus",
          "reference": "Ganong's Review of Medical Physiology, 26th ed., Ch. 38",
          "text": "The macula densa cells of the juxtaglomerular apparatus respond to changes in tubular fluid composition by sensing which of the following parameters?",
          "options": [
            "Sodium and chloride concentration in the early distal convoluted tubule",
            "Potassium concentration in the proximal convoluted tubule",
            "Hydrostatic pressure inside Bowman capsule",
            "Osmolality of the medullary collecting duct"
          ],
          "correctAnswerIndex": 0,
          "explanation": "Macula densa cells located in the wall of the early distal tubule sense luminal NaCl concentration via the NKCC2 cotransporter, modulating renin release by adjacent juxtaglomerular cells through tubuloglomerular feedback.",
          "style": "One-Liner"
        }
      ]
    },
    {
      "id": "sec_b",
      "name": "Section B",
      "durationMinutes": 5,
      "questions": [
        {
          "id": "neet_q_5",
          "subject": [
            "Biochemistry",
            "Pediatrics"
          ],
          "system": [
            "Gastrointestinal System",
            "Endocrine System"
          ],
          "format": "Single Best Answer",
          "difficulty": "Medium",
          "topic": "Glycogen Storage Diseases",
          "reference": "Nelson Textbook of Pediatrics, 21st ed., Ch. 104; Harper's Illustrated Biochemistry, 32nd ed.",
          "text": "A 5-month-old infant presents with severe fasting hypoglycemia, lactic acidosis, hyperuricemia, and massive hepatomegaly with doll-like facies. Liver biopsy demonstrates marked intracellular glycogen accumulation with normal glycogen structure. Which enzyme deficiency is responsible?",
          "options": [
            "Glucose-6-phosphatase",
            "Liver glycogen phosphorylase",
            "Lysosomal alpha-1,4-glucosidase",
            "Amylo-1,6-glucosidase (debranching enzyme)"
          ],
          "correctAnswerIndex": 0,
          "explanation": "Von Gierke disease (Glycogen Storage Disease Type Ia) is caused by Glucose-6-phosphatase deficiency. It leads to severe fasting hypoglycemia, hepatomegaly, lactic acidosis, and hyperuricemia.",
          "style": "Clinical Vignette"
        },
        {
          "id": "neet_q_6",
          "subject": [
            "Pathology",
            "Medicine"
          ],
          "system": [
            "Hematology & Oncology"
          ],
          "format": "Single Best Answer",
          "difficulty": "Easy",
          "topic": "Chronic Myeloid Leukemia & Cytogenetics",
          "reference": "Robbins and Cotran Pathologic Basis of Disease, 10th ed., Ch. 13",
          "text": "The reciprocal chromosomal translocation t(9;22)(q34;q11), which forms the BCR-ABL1 chimeric fusion oncogene with constitutive tyrosine kinase activity, is the pathognomonic diagnostic hallmark of:",
          "options": [
            "Chronic Myeloid Leukemia (CML)",
            "Burkitt Lymphoma",
            "Acute Promyelocytic Leukemia (APML)",
            "Follicular Lymphoma"
          ],
          "correctAnswerIndex": 0,
          "explanation": "The Philadelphia chromosome t(9;22)(q34;q11) creates the BCR-ABL1 fusion gene, diagnostic of Chronic Myeloid Leukemia (CML) and responsive to tyrosine kinase inhibitors like Imatinib.",
          "style": "One-Liner"
        },
        {
          "id": "neet_q_7",
          "subject": [
            "Biochemistry",
            "Dermatology"
          ],
          "system": [
            "Integumentary System"
          ],
          "format": "Single Best Answer",
          "difficulty": "Medium",
          "topic": "DNA Repair Mechanisms & Genodermatoses",
          "reference": "Harper's Illustrated Biochemistry, 32nd ed., Ch. 35; Rook's Textbook of Dermatology, 9th ed.",
          "text": "A 4-year-old child presents with extreme photosensitivity, dry skin, multiple freckles on sun-exposed areas, and early development of basal cell carcinomas. This autosomal recessive disorder involves a defect in which DNA repair mechanism?",
          "options": [
            "Nucleotide excision repair",
            "Base excision repair",
            "Mismatch repair",
            "Non-homologous end joining"
          ],
          "correctAnswerIndex": 0,
          "explanation": "Xeroderma Pigmentosum is caused by inherited defects in nucleotide excision repair (NER), preventing excision of ultraviolet radiation-induced pyrimidine (thymine) dimers.",
          "style": "One-Liner"
        },
        {
          "id": "neet_q_8",
          "subject": [
            "Pathology",
            "Medicine"
          ],
          "system": [
            "Renal & Urinary System",
            "Immune System"
          ],
          "format": "Single Best Answer",
          "difficulty": "Hard",
          "topic": "Lupus Nephritis Pathology & Classification",
          "reference": "Heptinstall's Pathology of the Kidney, 7th ed.; Harrison's Principles of Internal Medicine, 21st ed., Ch. 356",